{
  "$schema": "https://json-schema.org/draft/2020-12/schema",
  "$id": "https://hextile.local/schemas/level.schema.json",
  "title": "Manifiesto de nivel HEXTILE",
  "description": "Estructura común para niveles en preparación y niveles completos.",
  "type": "object",
  "additionalProperties": false,
  "required": ["name", "deployed", "stage", "levelNumber", "originalSolution"],
  "properties": {
    "name": {
      "type": "string",
      "minLength": 1,
      "maxLength": 80
    },
    "deployed": {
      "type": "boolean",
      "default": false,
      "description": "Indica si el nivel ya fue publicado para jugarse. Los niveles nuevos comienzan en false."
    },
    "stage": {
      "type": "integer",
      "minimum": 1,
      "default": 1,
      "description": "Etapa a la que pertenece el nivel."
    },
    "levelNumber": {
      "type": ["integer", "null"],
      "minimum": 1,
      "default": null,
      "description": "Posición del nivel dentro de su etapa. Es null mientras no esté desplegado."
    },
    "originalSolution": {
      "$ref": "#/$defs/nonEmptyPlacements"
    },
    "initialDistribution": {
      "$ref": "#/$defs/placements"
    },
    "initialHand": {
      "$ref": "#/$defs/initialHand"
    }
  },
  "dependentRequired": {
    "initialDistribution": ["initialHand"],
    "initialHand": ["initialDistribution"]
  },
  "allOf": [
    {
      "if": {
        "properties": {
          "deployed": { "const": true }
        },
        "required": ["deployed"]
      },
      "then": {
        "properties": {
          "levelNumber": { "type": "integer", "minimum": 1 }
        }
      },
      "else": {
        "properties": {
          "levelNumber": { "type": "null" }
        }
      }
    }
  ],
  "$defs": {
    "color": {
      "type": "string",
      "enum": ["celeste", "verde", "morado", "azul", "naranja", "rojo"]
    },
    "placements": {
      "type": "object",
      "propertyNames": {
        "pattern": "^-?(0|[1-9][0-9]*),-?(0|[1-9][0-9]*)$"
      },
      "additionalProperties": {
        "$ref": "#/$defs/color"
      },
      "maxProperties": 225
    },
    "nonEmptyPlacements": {
      "type": "object",
      "propertyNames": {
        "pattern": "^-?(0|[1-9][0-9]*),-?(0|[1-9][0-9]*)$"
      },
      "additionalProperties": {
        "$ref": "#/$defs/color"
      },
      "minProperties": 1,
      "maxProperties": 225
    },
    "initialHand": {
      "type": "object",
      "additionalProperties": false,
      "required": ["celeste", "verde", "morado", "azul", "naranja", "rojo"],
      "properties": {
        "celeste": { "type": "integer", "minimum": 0, "maximum": 225 },
        "verde": { "type": "integer", "minimum": 0, "maximum": 225 },
        "morado": { "type": "integer", "minimum": 0, "maximum": 225 },
        "azul": { "type": "integer", "minimum": 0, "maximum": 225 },
        "naranja": { "type": "integer", "minimum": 0, "maximum": 225 },
        "rojo": { "type": "integer", "minimum": 0, "maximum": 225 }
      }
    }
  }
}
