{
  "name": "12C-dona",
  "originalSolution": {
    "0,-2": "celeste",
    "1,-2": "celeste",
    "-1,-1": "celeste",
    "0,-1": "celeste",
    "1,-1": "celeste",
    "-1,0": "celeste",
    "1,0": "celeste",
    "-1,1": "celeste",
    "0,1": "celeste",
    "1,1": "celeste",
    "-1,2": "celeste",
    "0,2": "celeste"
  },
  "initialDistribution": {
    "0,-2": "celeste",
    "0,2": "celeste"
  },
  "initialHand": {
    "celeste": 10,
    "verde": 0,
    "morado": 0,
    "azul": 0,
    "naranja": 0,
    "rojo": 0
  },
  "deployed": true,
  "stage": 1,
  "levelNumber": 4
}
