{
  "name": "V5-C12-M5_v1",
  "originalSolution": {
    "4,-4": "verde",
    "5,-4": "verde",
    "0,-3": "verde",
    "4,-3": "morado",
    "-1,-2": "morado",
    "0,-2": "celeste",
    "1,-2": "morado",
    "2,-2": "celeste",
    "3,-2": "celeste",
    "-1,-1": "celeste",
    "0,-1": "celeste",
    "2,-1": "celeste",
    "3,-1": "celeste",
    "4,-1": "celeste",
    "-1,0": "celeste",
    "3,0": "morado",
    "4,0": "verde",
    "-2,1": "morado",
    "-3,2": "celeste",
    "-2,2": "celeste",
    "-3,3": "celeste",
    "-2,3": "verde"
  },
  "initialDistribution": {
    "4,-4": "verde",
    "5,-4": "verde",
    "4,-3": "morado",
    "-1,-2": "morado",
    "2,-2": "celeste",
    "0,-1": "celeste",
    "2,-1": "celeste",
    "3,-1": "celeste",
    "4,0": "verde",
    "-2,1": "morado",
    "-2,3": "verde"
  },
  "initialHand": {
    "celeste": 8,
    "verde": 1,
    "morado": 2,
    "azul": 0,
    "naranja": 0,
    "rojo": 0
  },
  "deployed": false,
  "stage": 1,
  "levelNumber": null
}
